,body_text,label,body_text_clean,body_text_tokenized,body_text_nostop,body_text_stemmed,body_text_pos
103,My work ethic tonight is on a different level #sarcasm .. It'll wait till tomorrow,NOT_SARCASM,my work ethic tonight is on a different level itll wait till tomorrow,"['my', 'work', 'ethic', 'tonight', 'is', 'on', 'a', 'different', 'level', 'itll', 'wait', 'till', 'tomorrow']","['work', 'ethic', 'tonight', 'different', 'level', 'itll', 'wait', 'till', 'tomorrow']","['work', 'ethic', 'tonight', 'differ', 'level', 'itll', 'wait', 'till', 'tomorrow']","['work_NN', 'ethic_JJ', 'tonight_NN', 'differ_VBP', 'level_NN', 'itll_NN', 'wait_NN', 'till_NN', 'tomorrow_NN']"
104,All I want for mah birthday is...  2 Chainz feat. Kanye West - Birthday Song :: http://t.co/SL1MN88g,NOT_SARCASM,all i want for mah birthday is chainz feat kanye west birthday song,"['all', 'i', 'want', 'for', 'mah', 'birthday', 'is', 'chainz', 'feat', 'kanye', 'west', 'birthday', 'song']","['want', 'mah', 'birthday', 'chainz', 'feat', 'kanye', 'west', 'birthday', 'song']","['want', 'mah', 'birthday', 'chainz', 'feat', 'kany', 'west', 'birthday', 'song']","['want_JJ', 'mah_NN', 'birthday_NN', 'chainz_VBZ', 'feat_JJ', 'kany_JJ', 'west_JJS', 'birthday_NN', 'song_NN']"
105,Absolutely love being left to hang #SARCASM,SARCASM,absolutely love being left to hang,"['absolutely', 'love', 'being', 'left', 'to', 'hang']","['absolutely', 'love', 'left', 'hang']","['absolut', 'love', 'left', 'hang']","['absolut_RB', 'love_NN', 'left_VBD', 'hang_NN']"
106,Woo best part is the library tour #sarcasm,NOT_SARCASM,woo best part is the library tour,"['woo', 'best', 'part', 'is', 'the', 'library', 'tour']","['woo', 'best', 'part', 'library', 'tour']","['woo', 'best', 'part', 'librari', 'tour']","['woo_NN', 'best_JJS', 'part_NN', 'librari_VBZ', 'tour_NN']"
107,@NurmaFatihah pew yg rmai??,NOT_SARCASM,nurmafatihah pew yg rmai,"['nurmafatihah', 'pew', 'yg', 'rmai']","['nurmafatihah', 'pew', 'yg', 'rmai']","['nurmafatihah', 'pew', 'yg', 'rmai']","['nurmafatihah_JJ', 'pew_NN', 'yg_NN', 'rmai_NN']"
108,The OzMoGa Times is out! http://t.co/lv1gUDhB ▸ Top stories today via @ezonecom @SquareEggGames,NOT_SARCASM,the ozmoga times is out top stories today via ezonecom squareegggames,"['the', 'ozmoga', 'times', 'is', 'out', 'top', 'stories', 'today', 'via', 'ezonecom', 'squareegggames']","['ozmoga', 'times', 'top', 'stories', 'today', 'via', 'ezonecom', 'squareegggames']","['ozmoga', 'time', 'top', 'stori', 'today', 'via', 'ezonecom', 'squareegggam']","['ozmoga_JJ', 'time_NN', 'top_JJ', 'stori_NN', 'today_NN', 'via_IN', 'ezonecom_NN', 'squareegggam_NN']"
109,Love being left alone in the hall while people go and sing #sarcasm #loner,SARCASM,love being left alone in the hall while people go and sing,"['love', 'being', 'left', 'alone', 'in', 'the', 'hall', 'while', 'people', 'go', 'and', 'sing']","['love', 'left', 'alone', 'hall', 'people', 'go', 'sing']","['love', 'left', 'alon', 'hall', 'peopl', 'go', 'sing']","['love_NN', 'left_VBD', 'alon_RP', 'hall_NN', 'peopl_NN', 'go_VBP', 'sing_VBG']"
110,@lukebryanonline puts me in the bestttttt mooooood everrrrrr &lt;3,NOT_SARCASM,lukebryanonline puts me in the bestttttt mooooood everrrrrr lt,"['lukebryanonline', 'puts', 'me', 'in', 'the', 'bestttttt', 'mooooood', 'everrrrrr', 'lt']","['lukebryanonline', 'puts', 'bestttttt', 'mooooood', 'everrrrrr', 'lt']","['lukebryanonlin', 'put', 'bestttttt', 'mooooood', 'everrrrrr', 'lt']","['lukebryanonlin_NN', 'put_VBD', 'bestttttt_RB', 'mooooood_NN', 'everrrrrr_NN', 'lt_NN']"
111,And on top of it all our power is out #bestdayever #sarcasm,NOT_SARCASM,and on top of it all our power is out,"['and', 'on', 'top', 'of', 'it', 'all', 'our', 'power', 'is', 'out']","['top', 'power']","['top', 'power']","['top_JJ', 'power_NN']"
112,I'm so glad it never rains in the whee. #sarcasm,NOT_SARCASM,im so glad it never rains in the whee,"['im', 'so', 'glad', 'it', 'never', 'rains', 'in', 'the', 'whee']","['im', 'glad', 'never', 'rains', 'whee']","['im', 'glad', 'never', 'rain', 'whee']","['im_NN', 'glad_NN', 'never_RB', 'rain_VBP', 'whee_NNS']"
113,"Maryland absolutely, positively did the right thing not honoring James Franklin's ""Head Coach In Waiting"" status.  #sarcasm",NOT_SARCASM,maryland absolutely positively did the right thing not honoring james franklins head coach in waiting status,"['maryland', 'absolutely', 'positively', 'did', 'the', 'right', 'thing', 'not', 'honoring', 'james', 'franklins', 'head', 'coach', 'in', 'waiting', 'status']","['maryland', 'absolutely', 'positively', 'right', 'thing', 'honoring', 'james', 'franklins', 'head', 'coach', 'waiting', 'status']","['maryland', 'absolut', 'posit', 'right', 'thing', 'honor', 'jame', 'franklin', 'head', 'coach', 'wait', 'statu']","['maryland_NN', 'absolut_NN', 'posit_NN', 'right_JJ', 'thing_NN', 'honor_NN', 'jame_NN', 'franklin_JJ', 'head_NN', 'coach_NN', 'wait_NN', 'statu_NN']"
114,You are attracted to a wide variety of new ideas during this t... More for Capricorn http://t.co/p31ha9AU,NOT_SARCASM,you are attracted to a wide variety of new ideas during this t more for capricorn,"['you', 'are', 'attracted', 'to', 'a', 'wide', 'variety', 'of', 'new', 'ideas', 'during', 'this', 't', 'more', 'for', 'capricorn']","['attracted', 'wide', 'variety', 'new', 'ideas', 'capricorn']","['attract', 'wide', 'varieti', 'new', 'idea', 'capricorn']","['attract_JJ', 'wide_JJ', 'varieti_NN', 'new_JJ', 'idea_NN', 'capricorn_NN']"
115,Rrg my teeth ache so much!!! Oh well anything for straight teeth. #sarcasm,NOT_SARCASM,rrg my teeth ache so much oh well anything for straight teeth,"['rrg', 'my', 'teeth', 'ache', 'so', 'much', 'oh', 'well', 'anything', 'for', 'straight', 'teeth']","['rrg', 'teeth', 'ache', 'much', 'oh', 'well', 'anything', 'straight', 'teeth']","['rrg', 'teeth', 'ach', 'much', 'oh', 'well', 'anyth', 'straight', 'teeth']","['rrg_NN', 'teeth_VBZ', 'ach_RB', 'much_JJ', 'oh_UH', 'well_RB', 'anyth_JJ', 'straight_VBD', 'teeth_NNS']"
116,Man kills daughter's BF in #gun control Germany with an EXPLOSION. as long as it's not a gun! #sarcasm #NRA http://t.co/uRi7nk9s,NOT_SARCASM,man kills daughters bf in control germany with an explosion as long as its not a gun,"['man', 'kills', 'daughters', 'bf', 'in', 'control', 'germany', 'with', 'an', 'explosion', 'as', 'long', 'as', 'its', 'not', 'a', 'gun']","['man', 'kills', 'daughters', 'bf', 'control', 'germany', 'explosion', 'long', 'gun']","['man', 'kill', 'daughter', 'bf', 'control', 'germani', 'explos', 'long', 'gun']","['man_NN', 'kill_VB', 'daughter_JJ', 'bf_NNS', 'control_NN', 'germani_VBP', 'explos_RB', 'long_RB', 'gun_NN']"
117,Sometimes I can't tell if @katecarneyy is serious or not  #sarcasm,NOT_SARCASM,sometimes i cant tell if katecarneyy is serious or not,"['sometimes', 'i', 'cant', 'tell', 'if', 'katecarneyy', 'is', 'serious', 'or', 'not']","['sometimes', 'cant', 'tell', 'katecarneyy', 'serious']","['sometim', 'cant', 'tell', 'katecarneyi', 'seriou']","['sometim_NN', 'cant_NN', 'tell_NN', 'katecarneyi_CD', 'seriou_NN']"
118,UK Truebies not long now until those of you with Sky and Virgin get to see the fabulous fifth season of True... http://t.co/qtKFi8ot,NOT_SARCASM,uk truebies not long now until those of you with sky and virgin get to see the fabulous fifth season of true,"['uk', 'truebies', 'not', 'long', 'now', 'until', 'those', 'of', 'you', 'with', 'sky', 'and', 'virgin', 'get', 'to', 'see', 'the', 'fabulous', 'fifth', 'season', 'of', 'true']","['uk', 'truebies', 'long', 'sky', 'virgin', 'get', 'see', 'fabulous', 'fifth', 'season', 'true']","['uk', 'truebi', 'long', 'sky', 'virgin', 'get', 'see', 'fabul', 'fifth', 'season', 'true']","['uk_JJ', 'truebi_NN', 'long_RB', 'sky_JJ', 'virgin_NN', 'get_VB', 'see_JJ', 'fabul_JJ', 'fifth_JJ', 'season_NN', 'true_JJ']"
119,@FlossMoore Check out the 3rd #LabLife installment http://t.co/YSvRL6ez,NOT_SARCASM,flossmoore check out the rd installment,"['flossmoore', 'check', 'out', 'the', 'rd', 'installment']","['flossmoore', 'check', 'rd', 'installment']","['flossmoor', 'check', 'rd', 'instal']","['flossmoor_JJ', 'check_NN', 'rd_NN', 'instal_NN']"
120,@LeeLiLo_90 @jemlaa90 I wudnt say funny lmao!! #Sarcasm,NOT_SARCASM,leelilo jemlaa i wudnt say funny lmao,"['leelilo', 'jemlaa', 'i', 'wudnt', 'say', 'funny', 'lmao']","['leelilo', 'jemlaa', 'wudnt', 'say', 'funny', 'lmao']","['leelilo', 'jemlaa', 'wudnt', 'say', 'funni', 'lmao']","['leelilo_NN', 'jemlaa_NN', 'wudnt_NNS', 'say_VBP', 'funni_JJ', 'lmao_NN']"
121,"Well the lady that trimmed my hair did an AWESOME job. #Sarcasm
Callback #: 319-231-7015 http://t.co/B2ev1MRa",NOT_SARCASM,well the lady that trimmed my hair did an awesome job,"['well', 'the', 'lady', 'that', 'trimmed', 'my', 'hair', 'did', 'an', 'awesome', 'job']","['well', 'lady', 'trimmed', 'hair', 'awesome', 'job']","['well', 'ladi', 'trim', 'hair', 'awesom', 'job']","['well_RB', 'ladi_RB', 'trim_JJ', 'hair_NN', 'awesom_NNS', 'job_NN']"
122,No my roommate play out of tune Zeppelin songs right outside my door isnt annoying. Not at all #sarcasm #sigh,SARCASM,no my roommate play out of tune zeppelin songs right outside my door isnt annoying not at all,"['no', 'my', 'roommate', 'play', 'out', 'of', 'tune', 'zeppelin', 'songs', 'right', 'outside', 'my', 'door', 'isnt', 'annoying', 'not', 'at', 'all']","['roommate', 'play', 'tune', 'zeppelin', 'songs', 'right', 'outside', 'door', 'isnt', 'annoying']","['roommat', 'play', 'tune', 'zeppelin', 'song', 'right', 'outsid', 'door', 'isnt', 'annoy']","['roommat_NN', 'play_NN', 'tune_NN', 'zeppelin_NN', 'song_NN', 'right_RB', 'outsid_JJ', 'door_NN', 'isnt_NN', 'annoy_NN']"
123,"""Fuck hate"" bumper sticker on 64. So many small beings have proudly read that to their parents.  #RVA #firstwords",NOT_SARCASM,fuck hate bumper sticker on so many small beings have proudly read that to their parents,"['fuck', 'hate', 'bumper', 'sticker', 'on', 'so', 'many', 'small', 'beings', 'have', 'proudly', 'read', 'that', 'to', 'their', 'parents']","['fuck', 'hate', 'bumper', 'sticker', 'many', 'small', 'beings', 'proudly', 'read', 'parents']","['fuck', 'hate', 'bumper', 'sticker', 'mani', 'small', 'be', 'proudli', 'read', 'parent']","['fuck_JJ', 'hate_NN', 'bumper_NN', 'sticker_NN', 'mani_VBD', 'small_JJ', 'be_VB', 'proudli_VBN', 'read_JJ', 'parent_NN']"
124,8th grade orientation tonight #alwaysfun #sarcasm,NOT_SARCASM,th grade orientation tonight,"['th', 'grade', 'orientation', 'tonight']","['th', 'grade', 'orientation', 'tonight']","['th', 'grade', 'orient', 'tonight']","['th_NN', 'grade_VBD', 'orient_JJ', 'tonight_NN']"
125,I hate this class.,NOT_SARCASM,i hate this class,"['i', 'hate', 'this', 'class']","['hate', 'class']","['hate', 'class']","['hate_NN', 'class_NN']"
126,From car fan to house fan - Richard Turere's laters home improvement @afrigadget http://t.co/hEjY62H6,NOT_SARCASM,from car fan to house fan richard tureres laters home improvement afrigadget,"['from', 'car', 'fan', 'to', 'house', 'fan', 'richard', 'tureres', 'laters', 'home', 'improvement', 'afrigadget']","['car', 'fan', 'house', 'fan', 'richard', 'tureres', 'laters', 'home', 'improvement', 'afrigadget']","['car', 'fan', 'hous', 'fan', 'richard', 'turer', 'later', 'home', 'improv', 'afrigadget']","['car_NN', 'fan_NN', 'hous_JJ', 'fan_NN', 'richard_NN', 'turer_NN', 'later_RB', 'home_NN', 'improv_NN', 'afrigadget_NN']"
127,@kaywa_xo well done for understanding kayla! #sarcasm #youradickhead :),NOT_SARCASM,kaywa xo well done for understanding kayla,"['kaywa', 'xo', 'well', 'done', 'for', 'understanding', 'kayla']","['kaywa', 'xo', 'well', 'done', 'understanding', 'kayla']","['kaywa', 'xo', 'well', 'done', 'understand', 'kayla']","['kaywa_NN', 'xo_NNP', 'well_RB', 'done_VBN', 'understand_NN', 'kayla_NN']"
128,@HennaSaeed yup. They deserve this win..,NOT_SARCASM,hennasaeed yup they deserve this win,"['hennasaeed', 'yup', 'they', 'deserve', 'this', 'win']","['hennasaeed', 'yup', 'deserve', 'win']","['hennasae', 'yup', 'deserv', 'win']","['hennasae_NN', 'yup_NN', 'deserv_NN', 'win_NN']"
129,"@rahulpuri Absolutely! She just keeps re-tweeting anything and everything that mentions her name. My page is flooded! Enough, I said.",NOT_SARCASM,rahulpuri absolutely she just keeps re tweeting anything and everything that mentions her name my page is flooded enough i said,"['rahulpuri', 'absolutely', 'she', 'just', 'keeps', 're', 'tweeting', 'anything', 'and', 'everything', 'that', 'mentions', 'her', 'name', 'my', 'page', 'is', 'flooded', 'enough', 'i', 'said']","['rahulpuri', 'absolutely', 'keeps', 'tweeting', 'anything', 'everything', 'mentions', 'name', 'page', 'flooded', 'enough', 'said']","['rahulpuri', 'absolut', 'keep', 'tweet', 'anyth', 'everyth', 'mention', 'name', 'page', 'flood', 'enough', 'said']","['rahulpuri_NN', 'absolut_NN', 'keep_VB', 'tweet_NN', 'anyth_JJ', 'everyth_JJ', 'mention_NN', 'name_NN', 'page_NN', 'flood_VBD', 'enough_RB', 'said_VBD']"
130,Hahaha....wenger is a fucking genius...giroud is d only striker left in arsenal...lmao...#sarcasm!!,NOT_SARCASM,hahaha wenger is a fucking genius giroud is d only striker left in arsenal lmao,"['hahaha', 'wenger', 'is', 'a', 'fucking', 'genius', 'giroud', 'is', 'd', 'only', 'striker', 'left', 'in', 'arsenal', 'lmao']","['hahaha', 'wenger', 'fucking', 'genius', 'giroud', 'striker', 'left', 'arsenal', 'lmao']","['hahaha', 'wenger', 'fuck', 'geniu', 'giroud', 'striker', 'left', 'arsen', 'lmao']","['hahaha_NN', 'wenger_NN', 'fuck_VBD', 'geniu_JJ', 'giroud_NN', 'striker_NN', 'left_VBD', 'arsen_RP', 'lmao_NN']"
131,Youth Of The Nation - P.O.D. [HQ]: http://t.co/lTMD6zKl via @youtube thanks for this !!@thewhosoevers,NOT_SARCASM,youth of the nation p o d hq via youtube thanks for this thewhosoevers,"['youth', 'of', 'the', 'nation', 'p', 'o', 'd', 'hq', 'via', 'youtube', 'thanks', 'for', 'this', 'thewhosoevers']","['youth', 'nation', 'p', 'hq', 'via', 'youtube', 'thanks', 'thewhosoevers']","['youth', 'nation', 'p', 'hq', 'via', 'youtub', 'thank', 'thewhosoev']","['youth_NN', 'nation_NN', 'p_NN', 'hq_NN', 'via_IN', 'youtub_NN', 'thank_NN', 'thewhosoev_NN']"
132,@QueMarlee appreciate that man,NOT_SARCASM,quemarlee appreciate that man,"['quemarlee', 'appreciate', 'that', 'man']","['quemarlee', 'appreciate', 'man']","['quemarle', 'appreci', 'man']","['quemarle_NN', 'appreci_NN', 'man_NN']"
133,First day of senior year #woohoo #sarcasm,NOT_SARCASM,first day of senior year,"['first', 'day', 'of', 'senior', 'year']","['first', 'day', 'senior', 'year']","['first', 'day', 'senior', 'year']","['first_RB', 'day_NN', 'senior_JJ', 'year_NN']"
134,@Whereileaveyou I had that same feeling a month ago,NOT_SARCASM,whereileaveyou i had that same feeling a month ago,"['whereileaveyou', 'i', 'had', 'that', 'same', 'feeling', 'a', 'month', 'ago']","['whereileaveyou', 'feeling', 'month', 'ago']","['whereileavey', 'feel', 'month', 'ago']","['whereileavey_NNS', 'feel_VBP', 'month_NN', 'ago_IN']"
135,espn is disapionted that they didnt get the #CFL game tonight. it is monday night after all #mnf #sarcasm,NOT_SARCASM,espn is disapionted that they didnt get the game tonight it is monday night after all,"['espn', 'is', 'disapionted', 'that', 'they', 'didnt', 'get', 'the', 'game', 'tonight', 'it', 'is', 'monday', 'night', 'after', 'all']","['espn', 'disapionted', 'didnt', 'get', 'game', 'tonight', 'monday', 'night']","['espn', 'disapiont', 'didnt', 'get', 'game', 'tonight', 'monday', 'night']","['espn_NN', 'disapiont_NN', 'didnt_NN', 'get_VB', 'game_NN', 'tonight_NN', 'monday_NN', 'night_NN']"
136,We just tried to bleach joes ball hair but apparently it's too stubborn and won't turn blonde,NOT_SARCASM,we just tried to bleach joes ball hair but apparently its too stubborn and wont turn blonde,"['we', 'just', 'tried', 'to', 'bleach', 'joes', 'ball', 'hair', 'but', 'apparently', 'its', 'too', 'stubborn', 'and', 'wont', 'turn', 'blonde']","['tried', 'bleach', 'joes', 'ball', 'hair', 'apparently', 'stubborn', 'wont', 'turn', 'blonde']","['tri', 'bleach', 'joe', 'ball', 'hair', 'appar', 'stubborn', 'wont', 'turn', 'blond']","['tri_JJ', 'bleach_NN', 'joe_NN', 'ball_NN', 'hair_NN', 'appar_IN', 'stubborn_JJ', 'wont_JJ', 'turn_NN', 'blond_NN']"
137,Glad to know I mean so much to you. #sarcasm,NOT_SARCASM,glad to know i mean so much to you,"['glad', 'to', 'know', 'i', 'mean', 'so', 'much', 'to', 'you']","['glad', 'know', 'mean', 'much']","['glad', 'know', 'mean', 'much']","['glad_NN', 'know_VBP', 'mean_RB', 'much_JJ']"
138,Today is a fucking lovely day! Nothing can go wrong!,NOT_SARCASM,today is a fucking lovely day nothing can go wrong,"['today', 'is', 'a', 'fucking', 'lovely', 'day', 'nothing', 'can', 'go', 'wrong']","['today', 'fucking', 'lovely', 'day', 'nothing', 'go', 'wrong']","['today', 'fuck', 'love', 'day', 'noth', 'go', 'wrong']","['today_NN', 'fuck_JJ', 'love_NN', 'day_NN', 'noth_DT', 'go_VBP', 'wrong_JJ']"
139,"I must go like a page for me to look like ise a batty lord, just for one girl idk to get hair? vell chap my leg off and call me shorty",NOT_SARCASM,i must go like a page for me to look like ise a batty lord just for one girl idk to get hair vell chap my leg off and call me shorty,"['i', 'must', 'go', 'like', 'a', 'page', 'for', 'me', 'to', 'look', 'like', 'ise', 'a', 'batty', 'lord', 'just', 'for', 'one', 'girl', 'idk', 'to', 'get', 'hair', 'vell', 'chap', 'my', 'leg', 'off', 'and', 'call', 'me', 'shorty']","['must', 'go', 'like', 'page', 'look', 'like', 'ise', 'batty', 'lord', 'one', 'girl', 'idk', 'get', 'hair', 'vell', 'chap', 'leg', 'call', 'shorty']","['must', 'go', 'like', 'page', 'look', 'like', 'ise', 'batti', 'lord', 'one', 'girl', 'idk', 'get', 'hair', 'vell', 'chap', 'leg', 'call', 'shorti']","['must_MD', 'go_VB', 'like_IN', 'page_NN', 'look_VBP', 'like_IN', 'ise_NN', 'batti_NN', 'lord_NN', 'one_CD', 'girl_NN', 'idk_NN', 'get_VBP', 'hair_NN', 'vell_NN', 'chap_NN', 'leg_NN', 'call_NN', 'shorti_NN']"
140,Good job student finance is on top of things as per #sarcasm #didntwantmoneyanyway #notgunagetmwdown,SARCASM,good job student finance is on top of things as per,"['good', 'job', 'student', 'finance', 'is', 'on', 'top', 'of', 'things', 'as', 'per']","['good', 'job', 'student', 'finance', 'top', 'things', 'per']","['good', 'job', 'student', 'financ', 'top', 'thing', 'per']","['good_JJ', 'job_NN', 'student_NN', 'financ_RB', 'top_JJ', 'thing_NN', 'per_IN']"
141,i chose brown sugar mini wheats,NOT_SARCASM,i chose brown sugar mini wheats,"['i', 'chose', 'brown', 'sugar', 'mini', 'wheats']","['chose', 'brown', 'sugar', 'mini', 'wheats']","['chose', 'brown', 'sugar', 'mini', 'wheat']","['chose_VB', 'brown_JJ', 'sugar_NN', 'mini_NNS', 'wheat_NN']"
142,That plan to go to bed earlier in preparation for school went well. #sarcasm,SARCASM,that plan to go to bed earlier in preparation for school went well,"['that', 'plan', 'to', 'go', 'to', 'bed', 'earlier', 'in', 'preparation', 'for', 'school', 'went', 'well']","['plan', 'go', 'bed', 'earlier', 'preparation', 'school', 'went', 'well']","['plan', 'go', 'bed', 'earlier', 'prepar', 'school', 'went', 'well']","['plan_NN', 'go_VBP', 'bed_VBN', 'earlier_RBR', 'prepar_JJ', 'school_NN', 'went_VBD', 'well_RB']"
143,morning people. roadtrip today. unfortunately that means sitting in the car with my family for 3 or 4 hours. yay! #sarcasm,SARCASM,morning people roadtrip today unfortunately that means sitting in the car with my family for or hours yay,"['morning', 'people', 'roadtrip', 'today', 'unfortunately', 'that', 'means', 'sitting', 'in', 'the', 'car', 'with', 'my', 'family', 'for', 'or', 'hours', 'yay']","['morning', 'people', 'roadtrip', 'today', 'unfortunately', 'means', 'sitting', 'car', 'family', 'hours', 'yay']","['morn', 'peopl', 'roadtrip', 'today', 'unfortun', 'mean', 'sit', 'car', 'famili', 'hour', 'yay']","['morn_JJ', 'peopl_NN', 'roadtrip_NN', 'today_NN', 'unfortun_JJ', 'mean_JJ', 'sit_NN', 'car_NN', 'famili_JJ', 'hour_NN', 'yay_NN']"
144,Watch ALL of our coverage of the #GOP2012 in one place. Keep up with that hurricane too. http://t.co/wqcg49Yv,NOT_SARCASM,watch all of our coverage of the in one place keep up with that hurricane too,"['watch', 'all', 'of', 'our', 'coverage', 'of', 'the', 'in', 'one', 'place', 'keep', 'up', 'with', 'that', 'hurricane', 'too']","['watch', 'coverage', 'one', 'place', 'keep', 'hurricane']","['watch', 'coverag', 'one', 'place', 'keep', 'hurrican']","['watch_NN', 'coverag_VBP', 'one_CD', 'place_NN', 'keep_VB', 'hurrican_NN']"
145,you're my kryptoniteeeee!&lt;3 RT als je dit herkent (((one direction),NOT_SARCASM,youre my kryptoniteeeee lt rt als je dit herkent one direction,"['youre', 'my', 'kryptoniteeeee', 'lt', 'rt', 'als', 'je', 'dit', 'herkent', 'one', 'direction']","['youre', 'kryptoniteeeee', 'lt', 'rt', 'als', 'je', 'dit', 'herkent', 'one', 'direction']","['your', 'kryptoniteeee', 'lt', 'rt', 'al', 'je', 'dit', 'herkent', 'one', 'direct']","['your_PRP$', 'kryptoniteeee_NN', 'lt_NN', 'rt_NN', 'al_NN', 'je_NN', 'dit_NN', 'herkent_NN', 'one_CD', 'direct_NN']"
146,Rat Gooo to sleep ughhh,NOT_SARCASM,rat gooo to sleep ughhh,"['rat', 'gooo', 'to', 'sleep', 'ughhh']","['rat', 'gooo', 'sleep', 'ughhh']","['rat', 'gooo', 'sleep', 'ughhh']","['rat_NN', 'gooo_NN', 'sleep_NN', 'ughhh_NN']"
147,"Rock &amp; Roll Hall of Famers, The Yardbirds are back on tour,, check out http://t.co/FTCb2kjP  They brought us Jeff Beck Please Retweet",NOT_SARCASM,rock amp roll hall of famers the yardbirds are back on tour check out they brought us jeff beck please retweet,"['rock', 'amp', 'roll', 'hall', 'of', 'famers', 'the', 'yardbirds', 'are', 'back', 'on', 'tour', 'check', 'out', 'they', 'brought', 'us', 'jeff', 'beck', 'please', 'retweet']","['rock', 'amp', 'roll', 'hall', 'famers', 'yardbirds', 'back', 'tour', 'check', 'brought', 'us', 'jeff', 'beck', 'please', 'retweet']","['rock', 'amp', 'roll', 'hall', 'famer', 'yardbird', 'back', 'tour', 'check', 'brought', 'us', 'jeff', 'beck', 'pleas', 'retweet']","['rock_NN', 'amp_NN', 'roll_VBP', 'hall_NN', 'famer_NN', 'yardbird_NN', 'back_RB', 'tour_JJ', 'check_NN', 'brought_VBD', 'us_PRP', 'jeff_NN', 'beck_NN', 'pleas_NNS', 'retweet_NN']"
148,Can't wait to play tonight #sarcasm,NOT_SARCASM,cant wait to play tonight,"['cant', 'wait', 'to', 'play', 'tonight']","['cant', 'wait', 'play', 'tonight']","['cant', 'wait', 'play', 'tonight']","['cant_NN', 'wait_NN', 'play_NN', 'tonight_NN']"
149,Brain says he won't be making anymore transfers :( #exciting #sarcasm,NOT_SARCASM,brain says he wont be making anymore transfers,"['brain', 'says', 'he', 'wont', 'be', 'making', 'anymore', 'transfers']","['brain', 'says', 'wont', 'making', 'anymore', 'transfers']","['brain', 'say', 'wont', 'make', 'anymor', 'transfer']","['brain_NN', 'say_VBP', 'wont_JJ', 'make_VBP', 'anymor_NN', 'transfer_NN']"
150,Stupid android... -_-,NOT_SARCASM,stupid android,"['stupid', 'android']","['stupid', 'android']","['stupid', 'android']","['stupid_JJ', 'android_NN']"
151,my legs are so sore. and I have sunburn on my scalp. band camp is getting off to a great start. #sarcasm,SARCASM,my legs are so sore and i have sunburn on my scalp band camp is getting off to a great start,"['my', 'legs', 'are', 'so', 'sore', 'and', 'i', 'have', 'sunburn', 'on', 'my', 'scalp', 'band', 'camp', 'is', 'getting', 'off', 'to', 'a', 'great', 'start']","['legs', 'sore', 'sunburn', 'scalp', 'band', 'camp', 'getting', 'great', 'start']","['leg', 'sore', 'sunburn', 'scalp', 'band', 'camp', 'get', 'great', 'start']","['leg_NN', 'sore_NN', 'sunburn_NN', 'scalp_NN', 'band_NN', 'camp_NN', 'get_VBP', 'great_JJ', 'start_NN']"
152,"Woah Arsenal, don't make too many signings jesus! Let others buy players for once #sarcasm",NOT_SARCASM,woah arsenal dont make too many signings jesus let others buy players for once,"['woah', 'arsenal', 'dont', 'make', 'too', 'many', 'signings', 'jesus', 'let', 'others', 'buy', 'players', 'for', 'once']","['woah', 'arsenal', 'dont', 'make', 'many', 'signings', 'jesus', 'let', 'others', 'buy', 'players']","['woah', 'arsen', 'dont', 'make', 'mani', 'sign', 'jesu', 'let', 'other', 'buy', 'player']","['woah_NN', 'arsen_VBZ', 'dont_JJ', 'make_VB', 'mani_JJ', 'sign_NN', 'jesu_NN', 'let_NN', 'other_JJ', 'buy_VB', 'player_NN']"
153,@JTOlinger speak for yourself sir! I am excelling in this class #sarcasm,NOT_SARCASM,jtolinger speak for yourself sir i am excelling in this class,"['jtolinger', 'speak', 'for', 'yourself', 'sir', 'i', 'am', 'excelling', 'in', 'this', 'class']","['jtolinger', 'speak', 'sir', 'excelling', 'class']","['jtoling', 'speak', 'sir', 'excel', 'class']","['jtoling_VBG', 'speak_NN', 'sir_JJ', 'excel_JJ', 'class_NN']"
154,"@ESPN_BMX Pres. Obama should have said ""freestyle? Is that like dressage on a bike?""",NOT_SARCASM,espn bmx pres obama should have said freestyle is that like dressage on a bike,"['espn', 'bmx', 'pres', 'obama', 'should', 'have', 'said', 'freestyle', 'is', 'that', 'like', 'dressage', 'on', 'a', 'bike']","['espn', 'bmx', 'pres', 'obama', 'said', 'freestyle', 'like', 'dressage', 'bike']","['espn', 'bmx', 'pre', 'obama', 'said', 'freestyl', 'like', 'dressag', 'bike']","['espn_NN', 'bmx_NN', 'pre_NN', 'obama_NN', 'said_VBD', 'freestyl_NNS', 'like_IN', 'dressag_NNS', 'bike_IN']"
155,@GFBguy @TonyMichael @ServiTechLabs @rictownsend @Bpowatch Thank you for following MobileWorxs :),NOT_SARCASM,gfbguy tonymichael servitechlabs rictownsend bpowatch thank you for following mobileworxs,"['gfbguy', 'tonymichael', 'servitechlabs', 'rictownsend', 'bpowatch', 'thank', 'you', 'for', 'following', 'mobileworxs']","['gfbguy', 'tonymichael', 'servitechlabs', 'rictownsend', 'bpowatch', 'thank', 'following', 'mobileworxs']","['gfbguy', 'tonymichael', 'servitechlab', 'rictownsend', 'bpowatch', 'thank', 'follow', 'mobileworx']","['gfbguy_NN', 'tonymichael_NN', 'servitechlab_NN', 'rictownsend_VBP', 'bpowatch_NN', 'thank_NN', 'follow_VBP', 'mobileworx_NN']"
156,Away to bed,NOT_SARCASM,away to bed,"['away', 'to', 'bed']","['away', 'bed']","['away', 'bed']","['away_RB', 'bed_NN']"
