,body_text,label,body_text_clean,body_text_tokenized,body_text_nostop,body_text_stemmed,body_text_pos
427,Geech unlocked his and ain't know @DAPROBLEM6. Was going hack his twitter,NOT_SARCASM,geech unlocked his and aint know daproblem was going hack his twitter,"['geech', 'unlocked', 'his', 'and', 'aint', 'know', 'daproblem', 'was', 'going', 'hack', 'his', 'twitter']","['geech', 'unlocked', 'aint', 'know', 'daproblem', 'going', 'hack', 'twitter']","['geech', 'unlock', 'aint', 'know', 'daproblem', 'go', 'hack', 'twitter']","['geech_NN', 'unlock_JJ', 'aint_NN', 'know_VBP', 'daproblem_NN', 'go_VBP', 'hack_NN', 'twitter_NN']"
428,Wow its feels nice to be appreciated #sarcasm #suckyfriends,SARCASM,wow its feels nice to be appreciated,"['wow', 'its', 'feels', 'nice', 'to', 'be', 'appreciated']","['wow', 'feels', 'nice', 'appreciated']","['wow', 'feel', 'nice', 'appreci']","['wow_NN', 'feel_VB', 'nice_JJ', 'appreci_NN']"
429,Trying to find that one song to fall asleep to on pandora :)  time for bed have to wake up in a few hours for work. Then Toby Keith sunday!!,NOT_SARCASM,trying to find that one song to fall asleep to on pandora time for bed have to wake up in a few hours for work then toby keith sunday,"['trying', 'to', 'find', 'that', 'one', 'song', 'to', 'fall', 'asleep', 'to', 'on', 'pandora', 'time', 'for', 'bed', 'have', 'to', 'wake', 'up', 'in', 'a', 'few', 'hours', 'for', 'work', 'then', 'toby', 'keith', 'sunday']","['trying', 'find', 'one', 'song', 'fall', 'asleep', 'pandora', 'time', 'bed', 'wake', 'hours', 'work', 'toby', 'keith', 'sunday']","['tri', 'find', 'one', 'song', 'fall', 'asleep', 'pandora', 'time', 'bed', 'wake', 'hour', 'work', 'tobi', 'keith', 'sunday']","['tri_NN', 'find_VBP', 'one_CD', 'song_NN', 'fall_NN', 'asleep_NN', 'pandora_NN', 'time_NN', 'bed_VBD', 'wake_VB', 'hour_NN', 'work_NN', 'tobi_NN', 'keith_NN', 'sunday_NN']"
430,"My week on twitter: 1 new listings, 7 new followers, 1 mentions. Via: http://t.co/YB93GWp6",NOT_SARCASM,my week on twitter new listings new followers mentions via,"['my', 'week', 'on', 'twitter', 'new', 'listings', 'new', 'followers', 'mentions', 'via']","['week', 'twitter', 'new', 'listings', 'new', 'followers', 'mentions', 'via']","['week', 'twitter', 'new', 'list', 'new', 'follow', 'mention', 'via']","['week_NN', 'twitter_RB', 'new_JJ', 'list_NN', 'new_JJ', 'follow_JJ', 'mention_NN', 'via_IN']"
431,"It's crazy how few people use Facebook, people used to have hundreds say happy birthday to them now I usually just see 20 at the most..",NOT_SARCASM,its crazy how few people use facebook people used to have hundreds say happy birthday to them now i usually just see at the most,"['its', 'crazy', 'how', 'few', 'people', 'use', 'facebook', 'people', 'used', 'to', 'have', 'hundreds', 'say', 'happy', 'birthday', 'to', 'them', 'now', 'i', 'usually', 'just', 'see', 'at', 'the', 'most']","['crazy', 'people', 'use', 'facebook', 'people', 'used', 'hundreds', 'say', 'happy', 'birthday', 'usually', 'see']","['crazi', 'peopl', 'use', 'facebook', 'peopl', 'use', 'hundr', 'say', 'happi', 'birthday', 'usual', 'see']","['crazi_NN', 'peopl_NN', 'use_NN', 'facebook_NN', 'peopl_NN', 'use_NN', 'hundr_NNS', 'say_VBP', 'happi_JJ', 'birthday_JJ', 'usual_JJ', 'see_NN']"
432,"Yeah, I'm all about to marry someone serving life in prison. Makes perfect sense. #sarcasm",SARCASM,yeah im all about to marry someone serving life in prison makes perfect sense,"['yeah', 'im', 'all', 'about', 'to', 'marry', 'someone', 'serving', 'life', 'in', 'prison', 'makes', 'perfect', 'sense']","['yeah', 'im', 'marry', 'someone', 'serving', 'life', 'prison', 'makes', 'perfect', 'sense']","['yeah', 'im', 'marri', 'someon', 'serv', 'life', 'prison', 'make', 'perfect', 'sens']","['yeah_NN', 'im_NN', 'marri_NN', 'someon_NN', 'serv_JJ', 'life_NN', 'prison_NN', 'make_VBP', 'perfect_NN', 'sens_NNS']"
433,"@GinaBaldassarre Serious, sarcastic, or Bendtner-esque? Which is a combination of seriousness, feeling lucky, and sheer cockyness. #sarcasm",NOT_SARCASM,ginabaldassarre serious sarcastic or bendtner esque which is a combination of seriousness feeling lucky and sheer cockyness,"['ginabaldassarre', 'serious', 'sarcastic', 'or', 'bendtner', 'esque', 'which', 'is', 'a', 'combination', 'of', 'seriousness', 'feeling', 'lucky', 'and', 'sheer', 'cockyness']","['ginabaldassarre', 'serious', 'sarcastic', 'bendtner', 'esque', 'combination', 'seriousness', 'feeling', 'lucky', 'sheer', 'cockyness']","['ginabaldassarr', 'seriou', 'sarcast', 'bendtner', 'esqu', 'combin', 'serious', 'feel', 'lucki', 'sheer', 'cocky']","['ginabaldassarr_NN', 'seriou_NN', 'sarcast_NN', 'bendtner_NN', 'esqu_JJ', 'combin_NN', 'serious_JJ', 'feel_NN', 'lucki_NNS', 'sheer_VBP', 'cocky_NN']"
434,I am fortunate to be able to speak the people's language. We help bring an understanding to things they already know.,NOT_SARCASM,i am fortunate to be able to speak the peoples language we help bring an understanding to things they already know,"['i', 'am', 'fortunate', 'to', 'be', 'able', 'to', 'speak', 'the', 'peoples', 'language', 'we', 'help', 'bring', 'an', 'understanding', 'to', 'things', 'they', 'already', 'know']","['fortunate', 'able', 'speak', 'peoples', 'language', 'help', 'bring', 'understanding', 'things', 'already', 'know']","['fortun', 'abl', 'speak', 'peopl', 'languag', 'help', 'bring', 'understand', 'thing', 'alreadi', 'know']","['fortun_NN', 'abl_NN', 'speak_NN', 'peopl_NN', 'languag_NN', 'help_NN', 'bring_VB', 'understand_JJ', 'thing_NN', 'alreadi_NN', 'know_VBP']"
435,Going to sleep... Byebye sweeties!!!! &lt;3,NOT_SARCASM,going to sleep byebye sweeties lt,"['going', 'to', 'sleep', 'byebye', 'sweeties', 'lt']","['going', 'sleep', 'byebye', 'sweeties', 'lt']","['go', 'sleep', 'byeby', 'sweeti', 'lt']","['go_VB', 'sleep_JJ', 'byeby_NN', 'sweeti_NN', 'lt_NN']"
436,"Man, the #SEC must be crazy deep if Vandy is playing South Carolina this close. #sarcasm #eyeroll",NOT_SARCASM,man the must be crazy deep if vandy is playing south carolina this close,"['man', 'the', 'must', 'be', 'crazy', 'deep', 'if', 'vandy', 'is', 'playing', 'south', 'carolina', 'this', 'close']","['man', 'must', 'crazy', 'deep', 'vandy', 'playing', 'south', 'carolina', 'close']","['man', 'must', 'crazi', 'deep', 'vandi', 'play', 'south', 'carolina', 'close']","['man_NN', 'must_MD', 'crazi_VB', 'deep_JJ', 'vandi_NN', 'play_NN', 'south_RB', 'carolina_VBD', 'close_JJ']"
437,"Photo of the day - cool, creamy mango sorbet from @Wahaca http://t.co/ZLJ39zJe",NOT_SARCASM,photo of the day cool creamy mango sorbet from wahaca,"['photo', 'of', 'the', 'day', 'cool', 'creamy', 'mango', 'sorbet', 'from', 'wahaca']","['photo', 'day', 'cool', 'creamy', 'mango', 'sorbet', 'wahaca']","['photo', 'day', 'cool', 'creami', 'mango', 'sorbet', 'wahaca']","['photo_NN', 'day_NN', 'cool_VBP', 'creami_NN', 'mango_NN', 'sorbet_NN', 'wahaca_NN']"
438,Props to the gamecocks for beating the big dominating team Vanderbilt by a whole 4 points! #Sarcasm.,NOT_SARCASM,props to the gamecocks for beating the big dominating team vanderbilt by a whole points,"['props', 'to', 'the', 'gamecocks', 'for', 'beating', 'the', 'big', 'dominating', 'team', 'vanderbilt', 'by', 'a', 'whole', 'points']","['props', 'gamecocks', 'beating', 'big', 'dominating', 'team', 'vanderbilt', 'whole', 'points']","['prop', 'gamecock', 'beat', 'big', 'domin', 'team', 'vanderbilt', 'whole', 'point']","['prop_NN', 'gamecock_NN', 'beat_VBD', 'big_JJ', 'domin_NN', 'team_NN', 'vanderbilt_VBD', 'whole_JJ', 'point_NN']"
439,this is going to be a fun semester... #sarcasm,NOT_SARCASM,this is going to be a fun semester,"['this', 'is', 'going', 'to', 'be', 'a', 'fun', 'semester']","['going', 'fun', 'semester']","['go', 'fun', 'semest']","['go_VB', 'fun_NN', 'semest_NN']"
440,Bromance is the key #deepthought #sarcasm,NOT_SARCASM,bromance is the key,"['bromance', 'is', 'the', 'key']","['bromance', 'key']","['bromanc', 'key']","['bromanc_NN', 'key_NN']"
441,"""I am careful not to confuse excellence with perfection. Excellence, I can reach for; perfection is God's business."" - Michael J. Fox",NOT_SARCASM,i am careful not to confuse excellence with perfection excellence i can reach for perfection is gods business michael j fox,"['i', 'am', 'careful', 'not', 'to', 'confuse', 'excellence', 'with', 'perfection', 'excellence', 'i', 'can', 'reach', 'for', 'perfection', 'is', 'gods', 'business', 'michael', 'j', 'fox']","['careful', 'confuse', 'excellence', 'perfection', 'excellence', 'reach', 'perfection', 'gods', 'business', 'michael', 'j', 'fox']","['care', 'confus', 'excel', 'perfect', 'excel', 'reach', 'perfect', 'god', 'busi', 'michael', 'j', 'fox']","['care_NN', 'confus_NN', 'excel_NN', 'perfect_JJ', 'excel_JJ', 'reach_NN', 'perfect_JJ', 'god_NN', 'busi_NN', 'michael_FW', 'j_NN', 'fox_NN']"
442,Physical therapy again. Woohoo #sarcasm,SARCASM,physical therapy again woohoo,"['physical', 'therapy', 'again', 'woohoo']","['physical', 'therapy', 'woohoo']","['physic', 'therapi', 'woohoo']","['physic_JJ', 'therapi_NN', 'woohoo_NN']"
443,"@MSMasoet hahahahahaha yes Sa'eed, cos you're the only person I ever think about #sarcasm #youfunny",SARCASM,msmasoet hahahahahaha yes saeed cos youre the only person i ever think about,"['msmasoet', 'hahahahahaha', 'yes', 'saeed', 'cos', 'youre', 'the', 'only', 'person', 'i', 'ever', 'think', 'about']","['msmasoet', 'hahahahahaha', 'yes', 'saeed', 'cos', 'youre', 'person', 'ever', 'think']","['msmasoet', 'hahahahahaha', 'ye', 'saeed', 'co', 'your', 'person', 'ever', 'think']","['msmasoet_NN', 'hahahahahaha_NN', 'ye_NNP', 'saeed_VBD', 'co_VB', 'your_PRP$', 'person_NN', 'ever_RB', 'think_VBP']"
444,@IAm_MilesLong they don't listen...seriously,NOT_SARCASM,iam mileslong they dont listen seriously,"['iam', 'mileslong', 'they', 'dont', 'listen', 'seriously']","['iam', 'mileslong', 'dont', 'listen', 'seriously']","['iam', 'mileslong', 'dont', 'listen', 'serious']","['iam_NN', 'mileslong_JJ', 'dont_NN', 'listen_VBP', 'serious_JJ']"
445,Lol . That's attractive #sarcasm  http://t.co/9nsIL3pd,NOT_SARCASM,lol thats attractive,"['lol', 'thats', 'attractive']","['lol', 'thats', 'attractive']","['lol', 'that', 'attract']","['lol_NN', 'that_WDT', 'attract_NN']"
446,Siick! I got paid $80.69 so far by doing surveys! Can't wait for more! LOOK &gt; http://t.co/9cMyNcMN,NOT_SARCASM,siick i got paid so far by doing surveys cant wait for more look gt,"['siick', 'i', 'got', 'paid', 'so', 'far', 'by', 'doing', 'surveys', 'cant', 'wait', 'for', 'more', 'look', 'gt']","['siick', 'got', 'paid', 'far', 'surveys', 'cant', 'wait', 'look', 'gt']","['siick', 'got', 'paid', 'far', 'survey', 'cant', 'wait', 'look', 'gt']","['siick_NN', 'got_VBD', 'paid_VBN', 'far_RB', 'survey_NN', 'cant_JJ', 'wait_NN', 'look_NN', 'gt_NN']"
447,Love waking up super early #sarcasm,SARCASM,love waking up super early,"['love', 'waking', 'up', 'super', 'early']","['love', 'waking', 'super', 'early']","['love', 'wake', 'super', 'earli']","['love_VB', 'wake_NN', 'super_NN', 'earli_NN']"
448,I love when nobody answers me. #OHYES #sarcasm,SARCASM,i love when nobody answers me,"['i', 'love', 'when', 'nobody', 'answers', 'me']","['love', 'nobody', 'answers']","['love', 'nobodi', 'answer']","['love_VB', 'nobodi_NN', 'answer_NN']"
449,"@ErinEmpire woow pwrfect then you need wait at home ready , waiting their call, very funny #sarcasm",SARCASM,erinempire woow pwrfect then you need wait at home ready waiting their call very funny,"['erinempire', 'woow', 'pwrfect', 'then', 'you', 'need', 'wait', 'at', 'home', 'ready', 'waiting', 'their', 'call', 'very', 'funny']","['erinempire', 'woow', 'pwrfect', 'need', 'wait', 'home', 'ready', 'waiting', 'call', 'funny']","['erinempir', 'woow', 'pwrfect', 'need', 'wait', 'home', 'readi', 'wait', 'call', 'funni']","['erinempir_NN', 'woow_NN', 'pwrfect_VBP', 'need_VBP', 'wait_VBP', 'home_NN', 'readi_NN', 'wait_VBP', 'call_NN', 'funni_NN']"
450,How will I ever remember the codeword? It is so difficult... #sarcasm,NOT_SARCASM,how will i ever remember the codeword it is so difficult,"['how', 'will', 'i', 'ever', 'remember', 'the', 'codeword', 'it', 'is', 'so', 'difficult']","['ever', 'remember', 'codeword', 'difficult']","['ever', 'rememb', 'codeword', 'difficult']","['ever_RB', 'rememb_VBP', 'codeword_NN', 'difficult_JJ']"
451,What a fantastic feeling... #sarcasm,SARCASM,what a fantastic feeling,"['what', 'a', 'fantastic', 'feeling']","['fantastic', 'feeling']","['fantast', 'feel']","['fantast_NN', 'feel_NN']"
452,"@lalafashionista unless its LFC, cos there such a big club #sarcasm",NOT_SARCASM,lalafashionista unless its lfc cos there such a big club,"['lalafashionista', 'unless', 'its', 'lfc', 'cos', 'there', 'such', 'a', 'big', 'club']","['lalafashionista', 'unless', 'lfc', 'cos', 'big', 'club']","['lalafashionista', 'unless', 'lfc', 'co', 'big', 'club']","['lalafashionista_NN', 'unless_IN', 'lfc_JJ', 'co_NN', 'big_JJ', 'club_NN']"
453,Because I'm that dumb I don't know your tweets are about me #Sarcasm,SARCASM,because im that dumb i dont know your tweets are about me,"['because', 'im', 'that', 'dumb', 'i', 'dont', 'know', 'your', 'tweets', 'are', 'about', 'me']","['im', 'dumb', 'dont', 'know', 'tweets']","['im', 'dumb', 'dont', 'know', 'tweet']","['im_NN', 'dumb_JJ', 'dont_NN', 'know_VBP', 'tweet_NN']"
454,"Going to bed, hopefully when I wake up, juju will be ahead of those faggots and the voting will stop being messed with. :) nightttt.",NOT_SARCASM,going to bed hopefully when i wake up juju will be ahead of those faggots and the voting will stop being messed with nightttt,"['going', 'to', 'bed', 'hopefully', 'when', 'i', 'wake', 'up', 'juju', 'will', 'be', 'ahead', 'of', 'those', 'faggots', 'and', 'the', 'voting', 'will', 'stop', 'being', 'messed', 'with', 'nightttt']","['going', 'bed', 'hopefully', 'wake', 'juju', 'ahead', 'faggots', 'voting', 'stop', 'messed', 'nightttt']","['go', 'bed', 'hope', 'wake', 'juju', 'ahead', 'faggot', 'vote', 'stop', 'mess', 'nightttt']","['go_VB', 'bed_JJ', 'hope_NN', 'wake_NN', 'juju_NN', 'ahead_RB', 'faggot_VBD', 'vote_JJ', 'stop_JJ', 'mess_NN', 'nightttt_NN']"
455,"@TheBlondeRaven Oh yes, I live for them, seriously! It's so nice when you get called fat on a daily basis, isn't it? #sarcasm",SARCASM,theblonderaven oh yes i live for them seriously its so nice when you get called fat on a daily basis isnt it,"['theblonderaven', 'oh', 'yes', 'i', 'live', 'for', 'them', 'seriously', 'its', 'so', 'nice', 'when', 'you', 'get', 'called', 'fat', 'on', 'a', 'daily', 'basis', 'isnt', 'it']","['theblonderaven', 'oh', 'yes', 'live', 'seriously', 'nice', 'get', 'called', 'fat', 'daily', 'basis', 'isnt']","['theblonderaven', 'oh', 'ye', 'live', 'serious', 'nice', 'get', 'call', 'fat', 'daili', 'basi', 'isnt']","['theblonderaven_RB', 'oh_JJ', 'ye_NNS', 'live_VBP', 'serious_JJ', 'nice_JJ', 'get_NN', 'call_NN', 'fat_JJ', 'daili_NN', 'basi_NN', 'isnt_NN']"
456,Bush couldn't make it to the GOP convention because he's too busy trying to blow up the levees in New Orleans again. #tcot #sarcasm,NOT_SARCASM,bush couldnt make it to the gop convention because hes too busy trying to blow up the levees in new orleans again,"['bush', 'couldnt', 'make', 'it', 'to', 'the', 'gop', 'convention', 'because', 'hes', 'too', 'busy', 'trying', 'to', 'blow', 'up', 'the', 'levees', 'in', 'new', 'orleans', 'again']","['bush', 'couldnt', 'make', 'gop', 'convention', 'hes', 'busy', 'trying', 'blow', 'levees', 'new', 'orleans']","['bush', 'couldnt', 'make', 'gop', 'convent', 'he', 'busi', 'tri', 'blow', 'leve', 'new', 'orlean']","['bush_NN', 'couldnt_NNS', 'make_VBP', 'gop_JJ', 'convent_NN', 'he_PRP', 'busi_VBZ', 'tri_JJ', 'blow_NN', 'leve_VBP', 'new_JJ', 'orlean_NN']"
457,@carlwebber whatever plans you have scrap them. There's nowhere I'd rather be #sarcasm,NOT_SARCASM,carlwebber whatever plans you have scrap them theres nowhere id rather be,"['carlwebber', 'whatever', 'plans', 'you', 'have', 'scrap', 'them', 'theres', 'nowhere', 'id', 'rather', 'be']","['carlwebber', 'whatever', 'plans', 'scrap', 'theres', 'nowhere', 'id', 'rather']","['carlwebb', 'whatev', 'plan', 'scrap', 'there', 'nowher', 'id', 'rather']","['carlwebb_NN', 'whatev_NN', 'plan_NN', 'scrap_VBP', 'there_RB', 'nowher_RB', 'id_NN', 'rather_RB']"
458,I like going to chem and learning about NASA.. #sarcasm?,SARCASM,i like going to chem and learning about nasa,"['i', 'like', 'going', 'to', 'chem', 'and', 'learning', 'about', 'nasa']","['like', 'going', 'chem', 'learning', 'nasa']","['like', 'go', 'chem', 'learn', 'nasa']","['like_IN', 'go_VBP', 'chem_NN', 'learn_NN', 'nasa_NN']"
459,@SpecialKBrook @carl_froch @skysports ringside gets right in there telling you how it is,NOT_SARCASM,specialkbrook carl froch skysports ringside gets right in there telling you how it is,"['specialkbrook', 'carl', 'froch', 'skysports', 'ringside', 'gets', 'right', 'in', 'there', 'telling', 'you', 'how', 'it', 'is']","['specialkbrook', 'carl', 'froch', 'skysports', 'ringside', 'gets', 'right', 'telling']","['specialkbrook', 'carl', 'froch', 'skysport', 'ringsid', 'get', 'right', 'tell']","['specialkbrook_NN', 'carl_NN', 'froch_NN', 'skysport_NN', 'ringsid_NN', 'get_VB', 'right_JJ', 'tell_NN']"
460,"All the people on Twitter this morning are like really sarcastic, lmao. #sarcasm",NOT_SARCASM,all the people on twitter this morning are like really sarcastic lmao,"['all', 'the', 'people', 'on', 'twitter', 'this', 'morning', 'are', 'like', 'really', 'sarcastic', 'lmao']","['people', 'twitter', 'morning', 'like', 'really', 'sarcastic', 'lmao']","['peopl', 'twitter', 'morn', 'like', 'realli', 'sarcast', 'lmao']","['peopl_NN', 'twitter_NN', 'morn_VBP', 'like_IN', 'realli_NN', 'sarcast_NN', 'lmao_NN']"
461,16 people followed me and 3 people unfollowed me // automatically checked by http://t.co/EjcOfHCn,NOT_SARCASM,people followed me and people unfollowed me automatically checked by,"['people', 'followed', 'me', 'and', 'people', 'unfollowed', 'me', 'automatically', 'checked', 'by']","['people', 'followed', 'people', 'unfollowed', 'automatically', 'checked']","['peopl', 'follow', 'peopl', 'unfollow', 'automat', 'check']","['peopl_NN', 'follow_VBP', 'peopl_NN', 'unfollow_JJ', 'automat_NN', 'check_NN']"
462,@brisbanebroncos I think so. I don't remember him being very good though. #sarcasm #clearly #lol,NOT_SARCASM,brisbanebroncos i think so i dont remember him being very good though,"['brisbanebroncos', 'i', 'think', 'so', 'i', 'dont', 'remember', 'him', 'being', 'very', 'good', 'though']","['brisbanebroncos', 'think', 'dont', 'remember', 'good', 'though']","['brisbanebronco', 'think', 'dont', 'rememb', 'good', 'though']","['brisbanebronco_NN', 'think_VBP', 'dont_JJ', 'rememb_NN', 'good_JJ', 'though_IN']"
463,tugas oh tugas,NOT_SARCASM,tugas oh tugas,"['tugas', 'oh', 'tugas']","['tugas', 'oh', 'tugas']","['tuga', 'oh', 'tuga']","['tuga_NN', 'oh_UH', 'tuga_NN']"
464,Evaluasi terakhir selesai tinggal bertanding di PON (҂'̀⌣'́)9 semangaaat !!!!!!!,NOT_SARCASM,evaluasi terakhir selesai tinggal bertanding di pon semangaaat,"['evaluasi', 'terakhir', 'selesai', 'tinggal', 'bertanding', 'di', 'pon', 'semangaaat']","['evaluasi', 'terakhir', 'selesai', 'tinggal', 'bertanding', 'di', 'pon', 'semangaaat']","['evaluasi', 'terakhir', 'selesai', 'tinggal', 'bertand', 'di', 'pon', 'semangaaat']","['evaluasi_NN', 'terakhir_NN', 'selesai_JJ', 'tinggal_JJ', 'bertand_NN', 'di_NN', 'pon_NN', 'semangaaat_NN']"
465,My ex boyfriend heard of At Sunset through his cousin. Lol. What a coincidence seeing as not many people in the UK have heard of them...,NOT_SARCASM,my ex boyfriend heard of at sunset through his cousin lol what a coincidence seeing as not many people in the uk have heard of them,"['my', 'ex', 'boyfriend', 'heard', 'of', 'at', 'sunset', 'through', 'his', 'cousin', 'lol', 'what', 'a', 'coincidence', 'seeing', 'as', 'not', 'many', 'people', 'in', 'the', 'uk', 'have', 'heard', 'of', 'them']","['ex', 'boyfriend', 'heard', 'sunset', 'cousin', 'lol', 'coincidence', 'seeing', 'many', 'people', 'uk', 'heard']","['ex', 'boyfriend', 'heard', 'sunset', 'cousin', 'lol', 'coincid', 'see', 'mani', 'peopl', 'uk', 'heard']","['ex_JJ', 'boyfriend_VB', 'heard_NN', 'sunset_NN', 'cousin_NN', 'lol_NN', 'coincid_NN', 'see_VBP', 'mani_JJ', 'peopl_NN', 'uk_JJ', 'heard_NN']"
466,"Cup of tea, cuddles with Henry and Dear John:(",NOT_SARCASM,cup of tea cuddles with henry and dear john,"['cup', 'of', 'tea', 'cuddles', 'with', 'henry', 'and', 'dear', 'john']","['cup', 'tea', 'cuddles', 'henry', 'dear', 'john']","['cup', 'tea', 'cuddl', 'henri', 'dear', 'john']","['cup_NN', 'tea_NN', 'cuddl_NN', 'henri_NN', 'dear_VBP', 'john_NN']"
467,thank god for spell check! #grammarnazi #sarcasm,NOT_SARCASM,thank god for spell check,"['thank', 'god', 'for', 'spell', 'check']","['thank', 'god', 'spell', 'check']","['thank', 'god', 'spell', 'check']","['thank_NN', 'god_NN', 'spell_NN', 'check_VB']"
468,I love the fact that my mom woke me up. #sarcasm,SARCASM,i love the fact that my mom woke me up,"['i', 'love', 'the', 'fact', 'that', 'my', 'mom', 'woke', 'me', 'up']","['love', 'fact', 'mom', 'woke']","['love', 'fact', 'mom', 'woke']","['love_VB', 'fact_NN', 'mom_NN', 'woke_VBD']"
469,I don't even understand why I cringe at everything,NOT_SARCASM,i dont even understand why i cringe at everything,"['i', 'dont', 'even', 'understand', 'why', 'i', 'cringe', 'at', 'everything']","['dont', 'even', 'understand', 'cringe', 'everything']","['dont', 'even', 'understand', 'cring', 'everyth']","['dont_RB', 'even_RB', 'understand_VBP', 'cring_VBG', 'everyth_NN']"
470,So.. what's this new thing in school EVERYONE'S talking about #sarcasm,NOT_SARCASM,so whats this new thing in school everyones talking about,"['so', 'whats', 'this', 'new', 'thing', 'in', 'school', 'everyones', 'talking', 'about']","['whats', 'new', 'thing', 'school', 'everyones', 'talking']","['what', 'new', 'thing', 'school', 'everyon', 'talk']","['what_WP', 'new_JJ', 'thing_NN', 'school_NN', 'everyon_NN', 'talk_NN']"
471,I love waking up to shit like that. #sarcasm Today is already not starting off good. #hurt,SARCASM,i love waking up to shit like that today is already not starting off good,"['i', 'love', 'waking', 'up', 'to', 'shit', 'like', 'that', 'today', 'is', 'already', 'not', 'starting', 'off', 'good']","['love', 'waking', 'shit', 'like', 'today', 'already', 'starting', 'good']","['love', 'wake', 'shit', 'like', 'today', 'alreadi', 'start', 'good']","['love_VB', 'wake_NN', 'shit_NN', 'like_IN', 'today_NN', 'alreadi_IN', 'start_NN', 'good_NN']"
472,Great time to get sick #sarcasm,SARCASM,great time to get sick,"['great', 'time', 'to', 'get', 'sick']","['great', 'time', 'get', 'sick']","['great', 'time', 'get', 'sick']","['great_JJ', 'time_NN', 'get_VB', 'sick_JJ']"
473,Anyone have a place we could drink at? Alcohol will be provided just need a place! The original spot bailed. Hit me up! 503 550 6824,NOT_SARCASM,anyone have a place we could drink at alcohol will be provided just need a place the original spot bailed hit me up,"['anyone', 'have', 'a', 'place', 'we', 'could', 'drink', 'at', 'alcohol', 'will', 'be', 'provided', 'just', 'need', 'a', 'place', 'the', 'original', 'spot', 'bailed', 'hit', 'me', 'up']","['anyone', 'place', 'could', 'drink', 'alcohol', 'provided', 'need', 'place', 'original', 'spot', 'bailed', 'hit']","['anyon', 'place', 'could', 'drink', 'alcohol', 'provid', 'need', 'place', 'origin', 'spot', 'bail', 'hit']","['anyon_JJ', 'place_NN', 'could_MD', 'drink_VB', 'alcohol_NN', 'provid_NN', 'need_VBP', 'place_NN', 'origin_VBP', 'spot_NN', 'bail_NN', 'hit_NN']"
474,Late nights early mornings,NOT_SARCASM,late nights early mornings,"['late', 'nights', 'early', 'mornings']","['late', 'nights', 'early', 'mornings']","['late', 'night', 'earli', 'morn']","['late_RB', 'night_NN', 'earli_NN', 'morn_NN']"
475,Game tomorrow night (:,NOT_SARCASM,game tomorrow night,"['game', 'tomorrow', 'night']","['game', 'tomorrow', 'night']","['game', 'tomorrow', 'night']","['game_NN', 'tomorrow_NN', 'night_NN']"
476,@N_Jarvis Awww really?! And there's me thinking it could happen... #sarcasm Lol!,NOT_SARCASM,n jarvis awww really and theres me thinking it could happen lol,"['n', 'jarvis', 'awww', 'really', 'and', 'theres', 'me', 'thinking', 'it', 'could', 'happen', 'lol']","['n', 'jarvis', 'awww', 'really', 'theres', 'thinking', 'could', 'happen', 'lol']","['n', 'jarvi', 'awww', 'realli', 'there', 'think', 'could', 'happen', 'lol']","['n_JJ', 'jarvi_NN', 'awww_NN', 'realli_VBP', 'there_EX', 'think_VB', 'could_MD', 'happen_VB', 'lol_NN']"
477,"""Women who love republicans who hate them"" http://t.co/U6cb0D6A",NOT_SARCASM,women who love republicans who hate them,"['women', 'who', 'love', 'republicans', 'who', 'hate', 'them']","['women', 'love', 'republicans', 'hate']","['women', 'love', 'republican', 'hate']","['women_NNS', 'love_VBP', 'republican_JJ', 'hate_NN']"
478,I love having my umbrella break while walking in the pouring rain across campus! #BestFeelingEver #Sarcasm,NOT_SARCASM,i love having my umbrella break while walking in the pouring rain across campus,"['i', 'love', 'having', 'my', 'umbrella', 'break', 'while', 'walking', 'in', 'the', 'pouring', 'rain', 'across', 'campus']","['love', 'umbrella', 'break', 'walking', 'pouring', 'rain', 'across', 'campus']","['love', 'umbrella', 'break', 'walk', 'pour', 'rain', 'across', 'campu']","['love_VB', 'umbrella_NN', 'break_NN', 'walk_VBP', 'pour_JJ', 'rain_NN', 'across_IN', 'campu_NN']"
479,You know I'd fall apart without you.. Don't know how you do what you do&lt;3,NOT_SARCASM,you know id fall apart without you dont know how you do what you do lt,"['you', 'know', 'id', 'fall', 'apart', 'without', 'you', 'dont', 'know', 'how', 'you', 'do', 'what', 'you', 'do', 'lt']","['know', 'id', 'fall', 'apart', 'without', 'dont', 'know', 'lt']","['know', 'id', 'fall', 'apart', 'without', 'dont', 'know', 'lt']","['know_VB', 'id_JJ', 'fall_NN', 'apart_RB', 'without_IN', 'dont_NN', 'know_VBP', 'lt_NN']"
